{
  "schema_version": "aepm-0.1",
  "project_intent": {
    "name": "Service Request Portal",
    "summary": "Create one governed portal for customers to submit and track service requests.",
    "problem": "Requests arrive through disconnected email threads and cannot be measured.",
    "opportunity": "Give customers and service teams a shared, traceable workflow."
  },
  "business_outcomes": [
    {
      "id": "OUT-001",
      "description": "Reduce the time needed to acknowledge a new request.",
      "indicators": ["95% of requests acknowledged within 15 minutes"]
    }
  ],
  "stakeholders": [
    {
      "id": "STK-001",
      "name": "Service Operations Lead",
      "role": "Business owner",
      "responsibilities": ["Own request policy", "Approve workflow changes"]
    }
  ],
  "capabilities": [
    {
      "id": "CAP-001",
      "name": "Request intake",
      "description": "Capture and classify a customer service request.",
      "owner_stakeholder_id": "STK-001"
    }
  ],
  "core_processes": [
    {
      "id": "PROC-001",
      "name": "Triage request",
      "description": "Validate, classify, and assign a submitted request.",
      "trigger": "A customer submits a complete request.",
      "outputs": ["Assigned request", "Acknowledgement notification"]
    }
  ],
  "business_rules": [
    {
      "id": "RULE-001",
      "description": "Only an authenticated customer may view their request details."
    }
  ],
  "data_entities": [
    {
      "id": "ENT-001",
      "name": "Service Request",
      "description": "The governed record of a customer's requested service.",
      "owner_stakeholder_id": "STK-001"
    }
  ],
  "integrations": [
    {
      "id": "INT-001",
      "name": "Identity Provider",
      "system": "Managed OIDC provider",
      "purpose": "Authenticate customers and service operators.",
      "security_rules": ["Use authorization code flow with PKCE", "Do not store passwords"]
    }
  ],
  "quality_requirements": [
    {
      "id": "QUAL-001",
      "category": "performance",
      "description": "Interactive portal requests must respond quickly under normal load.",
      "acceptance_criteria": ["95th percentile API latency is below 500 ms"]
    }
  ],
  "constraints": [
    {
      "id": "CON-001",
      "category": "technical",
      "description": "The first release must run in Docker on a single managed environment."
    }
  ],
  "preferred_technology_targets": {
    "frontend": ["React"],
    "backend": ["Python", "FastAPI"],
    "database": ["PostgreSQL"],
    "queue": ["Redis"],
    "object_storage": ["S3-compatible storage"],
    "deployment": ["Docker"]
  }
}
